study_label,year_of_publication,title_of_article,study_context
Westbrook experiment 1 (2013),2013,"What Is the Subjective Cost of Cognitive Effort? Load,Trait, and Aging Effects Revealed by Economic Preference",in-person
Westbrook experiment 2 (2013),2013,"What Is the Subjective Cost of Cognitive Effort? Load,Trait, and Aging Effects Revealed by Economic Preference",in-person
Hess (2021),2021,Predictors of Engagement in Young and Older Adults: The Role ofSpecific Activity Experience,in-person
Chen (2020),2020,Dopamine-Dependent Loss Aversion during Effort-Based Decision-Making,in-person
McLaughlin (2021),2021,Measuring the Subjective Cost of Listening Effort Using a Discounting Task,in-person
Seaman (2016),2016,Adult Age Differences in Decision Making Across Domains: Increased Discounting of Social and Health-Related Rewards,in-person
Lockwood (2021),2021,Aging Increases Prosocial Motivation for Effort,in-person